{
  "title": "道德经：你的人生计划，正在让你过不上你想要的生活",
  "language": "zh-CN",
  "chapters": [
    { "id": "1", "label": "第一期" },
    { "id": "2", "label": "道与地图" },
    { "id": "3", "label": "上善若水" },
    { "id": "4", "label": "生产者的牢笼" }
  ],
  "output": {
    "width": 1920,
    "height": 1080,
    "fps": 30,
    "filename": "daodejing-ep01.mp4"
  },
  "style": {
    "background_color": "#0a1210",
    "subtitle_style": "shadow",
    "subtitle_align": "center",
    "subtitle_font_size": 34,
    "subtitle_color": "#f2f0e8",
    "subtitle_margin_bottom": 100
  },
  "watermark": {
    "text": "观念黑盒"
  },
  "tts": {
    "voice": "zh-CN-YunxiNeural",
    "rate": "-5%"
  },
  "ending": {
    "enabled": true,
    "image": "assets/avatar.webp",
    "duration_sec": 4,
    "narration": ""
  },
  "scenes": [
    {
      "id": "intro",
      "scene_type": "intro",
      "narration": "你的人生计划，可能正在让你过不上你真正想要的生活。不是因为你不够努力。恰恰相反——往往是因为你太努力地在执行一张旧地图。这是《道德经五讲》的第一期。我不会请你背诵原文，也不会用国学腔吓跑你。我要做的，是把老子当成一套操作系统：在一切都在变、AI 让「生产」变得越来越便宜的时代，你怎么少犯一个绝大多数聪明人都在犯的错——把地图当成道。我也不会告诉你：再努力一点就会好。更不会告诉你：只要找到「正确的赛道」人生就开了。我要告诉你的是另一件事：你可能一直在用别人的答案，回答你自己的命。如果你愿意听完这一期，你会带走一个问题，而不是一句口号。这个问题会跟着你进入后面四期：你到底在追「更多」，还是在对齐「更对」？"
    },
    {
      "id": "open-1",
      "scene_type": "chapter",
      "chapter": "1",
      "narration": "我们先从老子最有名的一句说起。道可道，非常道。翻译成今天的人话就是：凡是被你说死、写进笔记、做成模板的东西，都已经不是那个活生生的「道」了。",
      "duration_sec": 9,
      "pause_after_sec": 0.4
    },
    {
      "id": "section-1",
      "narration": "第一个论点：你手里那张人生地图，为什么总是不管用。我想先问你一个不舒服的问题：如果把你过去三年认真执行过的计划，写在一张纸上，你能指出哪一条真正改变了你的命运吗？不是让你更忙，而是让你更稳、更清醒、更接近你想要的生活。很多人答不上来。不是因为不努力，是因为努力都花在维护地图本身。你仔细想想去年和今年的差别。去年有效的职业路径，今年可能贬值。去年爆过的内容结构，今年可能失灵。去年让你自信的那套自律系统，今年可能变成自我惩罚。可你的大脑不喜欢「不知道」。大脑会把不确定当成威胁。所以你会本能地抓新地图：新课程、新方法论、新 AI 工具、新赛道叙事。每多一张地图，你就更安全一点——至少感觉上更安全。但感觉安全，不等于真的在前进。我见过太多人，笔记本里全是方法，生活里全是重复。他们不是不勤奋，他们是被地图拖住了。老子不是在反对学习。他反对的是：你把「命名」误当成「抵达」。就像你把导航语音当成目的地本身。你听见「前方五百米右转」，就以为自己已经到家了。更隐蔽的是：地图往往是别人画好的。父母的、平台的、算法的、成功学博主的。你只是在上面打卡。打卡越多，你越像在完成别人的道，而不是在活自己的道。你可能会问：那完全不要计划了吗？不是。计划可以是拐杖。但拐杖不能长进肉里。当拐杖长进肉里，你会为了维护计划，牺牲真实。牺牲睡眠，牺牲关系，牺牲好奇心，还牺牲你对错误的诚实。你会把「偏离计划」当成道德失败，而不是当成信息更新。这就是很多人越努力越痛苦的根子。所以这一期的核心，不是再给你一张更好的地图。而是请你承认：任何地图都有保质期。你要培养的能力，是辨认什么时候该扔掉地图，什么时候该抬头看路。这不是玄学，这是你在不确定时代的生存技能。"
    },
    {
      "id": "open-2",
      "scene_type": "chapter",
      "chapter": "2",
      "narration": "第二个论点：上善若水。为什么「像水一样」不是鸡汤，而是你今天最缺的生存策略。",
      "duration_sec": 9,
      "pause_after_sec": 0.4
    },
    {
      "id": "section-2",
      "narration": "在讲水之前，我想先帮你拆一个误会。很多人一听「上善若水」，脑子里冒出的是：我要更温柔，更佛系，更不争不抢。然后第二天该焦虑还是焦虑，该内卷还是内卷。老子不是让你换一个人设。他是教你换一套力学：别跟世界硬碰硬，除非硬碰硬真的是唯一选项。水有三个特点，对今天的人极其重要。第一，水有形状，但不执着形状。容器圆它就圆，容器方它就方。不是没原则，而是不把原则当成盔甲。很多人痛苦，是因为把身份焊死了：我是做内容的，我是做技术的，我是内向的，我是必须年入百万的。身份一焊死，环境一变，你就碎。你碎掉的时候，还会怪环境不懂你。可环境从来不承诺懂你。第二，水往低处走，却能穿石。这不是教你躺平。低处走，是说你先承认现实结构——限制、周期、人性——然后在结构里找缝，而不是对着墙撞。硬拧的人，看起来很有魄力，其实是在给 ego 付账单。你赢了一场争论，却输了整盘棋。第三，水不争。老子说的不争，不是让你当老好人。而是说：别把生命力浪费在「证明我对」上。互联网放大争胜欲。评论区、排行榜、同龄人对比，都在逼你争。可很多争，争的是面子，不是结果。你把争的面子让出去，常常反而更快抵达结果。这不是道德高地，这是精力管理。你可以把它翻译成现代语言：少做无效对抗，多做有效适应。所以「上善若水」在今天，不是一个姿势，而是一个每日问题——我是在适应局势，还是在跟局势赌气？如果答案是后者，你今晚大概率又睡不着。不是因为事情难，是因为你在用情绪对抗现实。而现实，从来不按你的情绪结账。"
    },
    {
      "id": "open-3",
      "scene_type": "chapter",
      "chapter": "3",
      "narration": "第三个论点：当 AI 能生产一切，你为什么反而更空。这里我们要提前揭开后面几期的伏笔。",
      "duration_sec": 9,
      "pause_after_sec": 0.4
    },
    {
      "id": "section-3",
      "narration": "这几年，有一种集体焦虑在蔓延：如果机器能写、能画、能分析、能编程，那我还有什么价值？于是更多人冲进「生产者赛道」——更努力地输出、更频繁地更新、更早地抢占注意力。你越是害怕被替代，就越想证明不可替代。证明的方式，就是生产更多。老子两千年前就碰过类似的问题，只是形式不同。那时是礼法、名教、话术太多。今天是工具、模板、内容太多。根子一样：用外在生产，填补内在空洞。我把这种状态叫「生产者的牢笼」。你以为价值来自「做出了什么」。于是你衡量每一天：写了多少字，发了多少条，学了多少课，跟 AI 对话多少小时。可道德经提醒你：道在「少」里显现，不在「堆」里膨胀。AI 让「堆」变得极其便宜。如果堆叠还便宜过你，你继续拼堆叠，只会更累、更空。更残酷的是：观众也越来越分不清，什么是你，什么是模型。当一切都能生成，生成本身不再稀缺。稀缺的是什么？是你的判断，你的品味，你的取舍，你敢在哪里说：到这里就够了。未来属于会提问的人，属于会删的人，属于敢在噪音里说「不必再做」的人。那出路是什么？不是立刻回答「做自己热爱的事」——那又一张地图。更诚实的第一步，是从生产者，慢慢转向判断者：什么值得存在？什么够好了？什么该停？你不需要马上辞职或断网。你只需要在今天留出一个十分钟，不做产出，只写下：如果我不必证明给谁看，我今天真正在乎的一件事是什么？这一问，比再开一个 Notion 模板更接近道。你可能会不舒服。因为「不生产」会让你直面自己。而直面自己，正是观念黑盒被打开的时刻。"
    },
    {
      "id": "open-4",
      "scene_type": "chapter",
      "chapter": "4",
      "narration": "今天只带走一个协议。我们叫它：地图脱钩练习。",
      "duration_sec": 8,
      "pause_after_sec": 0.4
    },
    {
      "id": "protocol",
      "narration": "在收束之前，我想把第一期和整个系列连起来。五讲的逻辑，其实是一条减法链：先承认地图会过期，再学会像水一样转弯，再学会从生产转向判断，再学会知足与知止，最后回到简单。你今天做的练习，就是这条链的起点。别小看一张纸条。大多数人一辈子都在换地图，却从不敢把地图从身上撕下来。协议很简单，三步。第一步，写下你当前最信的一张「人生地图」——可能是一个收入目标，一种身份，或一套你必须坚持的方法。只写一条，别写十条。写十条，你会骗自己说自己在思考，其实只是在堆焦虑。第二步，用一句话说明：这张地图最初保护过你什么？它帮你躲开了什么恐惧？是怕被看不起？怕落后？怕不被爱？第三步，也是最重要的一步，写一句：如果这张地图明天过期，我愿意保留的「方向感」是什么——不是数字，不是头衔，而是一种状态。比如：我更想冷静地看清局势。我更想少争而事成。我更想每天结束时问心无愧。做完这三步，你把纸收起来。不需要发朋友圈。这不是表演清醒，这是私下校准。你会突然发现：道从来不在更远的地方。道在你愿意扔掉过期地图的那一瞬间。如果你愿意，把这一页留着。五期之后回头看，你会看见自己少了很多硬拧，多了很多水一样的转弯。"
    },
    {
      "id": "closing",
      "narration": "好，第一期到这里。我们说了三件事：地图不是道；像水一样适应，而不是硬拧；AI 时代更要警惕生产者的牢笼。你不需要同意老子的一切。你只需要承认：在这个时代，继续用旧方式证明自己，成本会越来越高。下一期，我们会进入道德经最反直觉的一招——为道日损：你不是缺更多方法，你缺的是敢删。我们会谈身份、欲望、以及你为什么总是「加」而不是「减」。如果你愿意把这个系列当成打开观念黑盒的五把钥匙，不妨收藏这一期。我们第二期见。",
      "image": "assets/placeholder.jpg"
    }
  ]
}
